{
  "schema": "dev.woia.organization-registry/v1",
  "organization": {
    "id": "example-org",
    "name": "Example Organization"
  },
  "revision": 1,
  "departments": [
    {
      "id": "marketing",
      "orchestrator": "woia-marketing",
      "marketplace": "woia-marketplace-marketing",
      "project_ref": "project:marketing"
    },
    {
      "id": "sales",
      "orchestrator": "woia-sales",
      "marketplace": "woia-marketplace-sales",
      "project_ref": "project:sales"
    }
  ],
  "shared_resources": [
    {
      "id": "customers",
      "capability_plugin": "woia-customer-data",
      "system_of_record": "customer-data",
      "classification": "confidential",
      "description": "Shared customer source of truth used by Marketing and Sales."
    }
  ]
}
